[
  {
    "id": "seedance2-5-skill",
    "name": "Seedance 2.5 · 商业视频导演",
    "category": "AI视频",
    "tags": [
      "Seedance 2.5",
      "商业视频",
      "分镜",
      "人物真实感",
      "提示词编译"
    ],
    "prompt": "使用 seedance-2-5-prompt，把我提供的产品、人物、场景素材和广告 Brief 编排为可直接投喂 Seedance 2.5 的提示词。锁定产品与人物身份，按素材职责设计时间轴、镜头与声音，并完成 Human Realism、连续性、Prompt Readiness 和生成前风险检查。",
    "workflow": [
      "识别并规范产品、人物、场景、参考素材与广告目标",
      "分析主体并建立产品锁与人物身份锁",
      "设计创意结构、Hook、分镜、镜头语言与声音",
      "编译 Seedance 2.5 可执行提示词",
      "检查人物真实感、连续性、可拍性与生成前风险"
    ],
    "embedding": null,
    "downloads": 0,
    "stars": null,
    "version": "未声明",
    "created_time": "2026-08-19T00:00:00.000Z"
  },
  {
    "id": "tiktok-shop-seedance-2-5-skill",
    "name": "TikTok Shop · 海外电商视频",
    "category": "AI视频",
    "tags": [
      "TikTok Shop",
      "UGC",
      "海外电商",
      "趋势研究",
      "Seedance 2.5"
    ],
    "prompt": "使用 overseas-ecommerce-seedance，为我提供的产品制作面向目标国家与平台的海外电商短视频方案。请完成产品和受众分析、市场本地化、UGC 脚本、分镜、摄影、声音与 Seedance 2.5 提示词，并做一致性 QA；涉及近期趋势时只使用有日期和来源的真实数据。",
    "workflow": [
      "根据产品、链接、参考视频或趋势请求自动选择工作流",
      "分析产品、受众与目标市场本地化",
      "研究趋势或拆解爆款机制，区分实时数据与静态 Pattern",
      "生成 UGC 脚本、分镜、摄影、声音与 Seedance 2.5 提示词",
      "完成产品、人物、商业和 Seedance 一致性检查"
    ],
    "embedding": null,
    "downloads": 0,
    "stars": null,
    "version": "1.0.0",
    "created_time": "2026-08-26T00:00:00.000Z"
  },
  {
    "id": "geo",
    "name": "GEO V3 · 关键词&九大画像",
    "category": "GEO",
    "tags": [
      "GEO",
      "关键词策略",
      "企业画像",
      "内容规划",
      "证据管理"
    ],
    "prompt": "使用 geo-keyword-profile-template 分析我提供的企业资料。先说明 GEO V3 框架、已有事实与资料缺口，再按正式流程生成简约版关键词和九大画像；不要虚构企业、案例、资质、数据或验证结果。",
    "workflow": [
      "清洗企业资料并区分事实、证据与缺失项",
      "建立企业 GEO Profile、行业研究与竞争研究",
      "生成搜索意图、关键词矩阵、九大画像与垂直画像",
      "规划内容矩阵与动态发布策略",
      "执行 GEO 验证、缺口分析、内容补强与再次验证"
    ],
    "embedding": null,
    "downloads": 0,
    "stars": null,
    "version": "3.0.6",
    "created_time": "2026-08-24T00:00:00.000Z"
  },
  {
    "id": "geo-bd",
    "name": "GEO-BD · 企业初次诊断",
    "category": "GEO",
    "tags": [
      "GEO 诊断",
      "AI 认知",
      "竞品分析",
      "证据图谱",
      "复测报告"
    ],
    "prompt": "使用 geo-diagnostic-engine，根据我提供的企业事实、证据、真实 AI 观察和已确认竞品生成 Executive GEO 诊断。所有分数都要可追溯；缺失数据保持 UNKNOWN、NOT_RUN 或 INSUFFICIENT_DATA，并给出机会排序、P0 至 P3 行动计划和复测方法。",
    "workflow": [
      "读取客户资料并确认已有与缺失内容",
      "建立企业实体、Evidence Graph 与 AI 认知记录",
      "生成 Query Matrix 并分析竞品差距、EEAAP 与 EEAT",
      "计算 GEO Gap、Opportunity Score 与分级行动计划",
      "生成分层报告、验证计划与 Before/After 复测"
    ],
    "embedding": null,
    "downloads": 0,
    "stars": null,
    "version": "V3",
    "created_time": "2026-08-27T00:00:00.000Z"
  },
  {
    "id": "danyuange",
    "name": "国际版 GEO · 九大单元",
    "category": "自动化",
    "tags": [
      "GEO",
      "九大单元",
      "双语交付",
      "Excel",
      "制造商与服务商"
    ],
    "prompt": "使用 danyuange，读取我提供的客户资料。先根据真实填写字段判断客户是制造商还是服务商，再严格使用对应官方模板输出英文原版、纯中文分析版两份九大单元工作簿，并单独输出补充资料清单。不要使用模板示例补全客户事实。",
    "workflow": [
      "依据客户真实填写字段判定制造商或服务商",
      "选择对应官方模板并清空示例数据",
      "把客户内容映射到官方字段",
      "导出结构一致的英文原版与纯中文分析版工作簿",
      "单独整理缺失资料清单并完成交付自查"
    ],
    "embedding": null,
    "downloads": 0,
    "stars": null,
    "version": "未声明",
    "created_time": "2026-08-26T00:00:00.000Z"
  },
  {
    "id": "seedance-cinematic-director",
    "name": "Seedance Cinematic Director · 电影叙事导演",
    "category": "AI视频",
    "tags": [
      "Seedance",
      "电影导演",
      "叙事视频",
      "镜头设计",
      "人物表演"
    ],
    "prompt": "使用 seedance-cinematic-director，把我提供的故事或视频 Brief 转化为电影级导演方案和可直接复制的 Prompt。先确认或标注模型、时长、画幅、参考素材职责和不可改变的内容，再完成场景分析、人物表演、情绪时间线、走位、摄影、光线、环境、真实感、负向约束和结尾状态；最后按固定模板输出 Prompt，并给出表演、摄影、电影感和真实感评分。不要虚构平台不支持的参数。",
    "workflow": [
      "分析场景类型、戏剧目标、冲突、时间地点、视觉风格与起承转合",
      "为人物建立可观察的表情、呼吸、姿态、手部和动作过渡",
      "在镜头运动前确定空间锚点，再设计摄影、镜头、灯光、环境和真实感",
      "按电影、Seedance、商业或叙事模板编译可复制提示词",
      "用 Prompt Checker 评分并修订低于 80 分的部分，或说明不可用约束"
    ],
    "embedding": null,
    "downloads": 0,
    "stars": null,
    "version": "1.0",
    "created_time": "2026-09-12T00:00:00.000Z"
  }
]
